{
  "schema_version": "runtime_agent_manifest_v5",
  "runtime_agent_count": 25,
  "runtime_stage_count": 26,
  "canonical_l4_sequence": [
    "alpha_discovery",
    "cio_proposal",
    "cro_review",
    "execution_feasibility",
    "cio_final"
  ],
  "agents": [
    {
      "agent": "china",
      "layer": "macro",
      "prompt_ir_agent_id": "macro.china",
      "required_tools": [
        "get_china_macro_snapshot"
      ],
      "output_schema_fields": [
        "mode",
        "claims",
        "key_drivers",
        "components"
      ],
      "stages": [
        {
          "stage": "agent_run",
          "enablement": "enabled",
          "output_schema_ref": "macro.china.output.v1",
          "output_schema_fields": [
            "mode",
            "claims",
            "key_drivers",
            "components"
          ],
          "max_repair_attempts": 3,
          "required_source_ids": [],
          "produced_source_ids": [
            "upstream_agent_outputs"
          ]
        }
      ]
    },
    {
      "agent": "us_economy",
      "layer": "macro",
      "prompt_ir_agent_id": "macro.us_economy",
      "required_tools": [
        "get_us_macro_snapshot"
      ],
      "output_schema_fields": [
        "mode",
        "claims",
        "key_drivers",
        "components"
      ],
      "stages": [
        {
          "stage": "agent_run",
          "enablement": "enabled",
          "output_schema_ref": "macro.us_economy.output.v1",
          "output_schema_fields": [
            "mode",
            "claims",
            "key_drivers",
            "components"
          ],
          "max_repair_attempts": 3,
          "required_source_ids": [],
          "produced_source_ids": [
            "upstream_agent_outputs"
          ]
        }
      ]
    },
    {
      "agent": "eu_economy",
      "layer": "macro",
      "prompt_ir_agent_id": "macro.eu_economy",
      "required_tools": [
        "get_eu_macro_snapshot"
      ],
      "output_schema_fields": [
        "mode",
        "claims",
        "key_drivers",
        "components"
      ],
      "stages": [
        {
          "stage": "agent_run",
          "enablement": "enabled",
          "output_schema_ref": "macro.eu_economy.output.v1",
          "output_schema_fields": [
            "mode",
            "claims",
            "key_drivers",
            "components"
          ],
          "max_repair_attempts": 3,
          "required_source_ids": [],
          "produced_source_ids": [
            "upstream_agent_outputs"
          ]
        }
      ]
    },
    {
      "agent": "central_bank",
      "layer": "macro",
      "prompt_ir_agent_id": "macro.central_bank",
      "required_tools": [
        "get_central_bank_snapshot"
      ],
      "output_schema_fields": [
        "mode",
        "claims",
        "key_drivers",
        "components"
      ],
      "stages": [
        {
          "stage": "agent_run",
          "enablement": "enabled",
          "output_schema_ref": "macro.central_bank.output.v1",
          "output_schema_fields": [
            "mode",
            "claims",
            "key_drivers",
            "components"
          ],
          "max_repair_attempts": 3,
          "required_source_ids": [],
          "produced_source_ids": [
            "upstream_agent_outputs"
          ]
        }
      ]
    },
    {
      "agent": "us_financial_conditions",
      "layer": "macro",
      "prompt_ir_agent_id": "macro.us_financial_conditions",
      "required_tools": [
        "get_us_financial_conditions_snapshot"
      ],
      "output_schema_fields": [
        "mode",
        "claims",
        "key_drivers",
        "components"
      ],
      "stages": [
        {
          "stage": "agent_run",
          "enablement": "enabled",
          "output_schema_ref": "macro.us_financial_conditions.output.v1",
          "output_schema_fields": [
            "mode",
            "claims",
            "key_drivers",
            "components"
          ],
          "max_repair_attempts": 3,
          "required_source_ids": [],
          "produced_source_ids": [
            "upstream_agent_outputs"
          ]
        }
      ]
    },
    {
      "agent": "euro_area_financial_conditions",
      "layer": "macro",
      "prompt_ir_agent_id": "macro.euro_area_financial_conditions",
      "required_tools": [
        "get_euro_area_financial_conditions_snapshot"
      ],
      "output_schema_fields": [
        "mode",
        "claims",
        "key_drivers",
        "components"
      ],
      "stages": [
        {
          "stage": "agent_run",
          "enablement": "enabled",
          "output_schema_ref": "macro.euro_area_financial_conditions.output.v1",
          "output_schema_fields": [
            "mode",
            "claims",
            "key_drivers",
            "components"
          ],
          "max_repair_attempts": 3,
          "required_source_ids": [],
          "produced_source_ids": [
            "upstream_agent_outputs"
          ]
        }
      ]
    },
    {
      "agent": "commodities",
      "layer": "macro",
      "prompt_ir_agent_id": "macro.commodities",
      "required_tools": [
        "get_commodity_conditions_snapshot"
      ],
      "output_schema_fields": [
        "mode",
        "claims",
        "key_drivers",
        "components"
      ],
      "stages": [
        {
          "stage": "agent_run",
          "enablement": "enabled",
          "output_schema_ref": "macro.commodities.output.v1",
          "output_schema_fields": [
            "mode",
            "claims",
            "key_drivers",
            "components"
          ],
          "max_repair_attempts": 3,
          "required_source_ids": [],
          "produced_source_ids": [
            "upstream_agent_outputs"
          ]
        }
      ]
    },
    {
      "agent": "institutional_flow",
      "layer": "macro",
      "prompt_ir_agent_id": "macro.institutional_flow",
      "required_tools": [
        "get_market_positioning_snapshot"
      ],
      "output_schema_fields": [
        "mode",
        "claims",
        "key_drivers",
        "signal"
      ],
      "stages": [
        {
          "stage": "agent_run",
          "enablement": "enabled",
          "output_schema_ref": "macro.institutional_flow.output.v1",
          "output_schema_fields": [
            "mode",
            "claims",
            "key_drivers",
            "signal"
          ],
          "max_repair_attempts": 3,
          "required_source_ids": [],
          "produced_source_ids": [
            "upstream_agent_outputs"
          ]
        }
      ]
    },
    {
      "agent": "semiconductor",
      "layer": "sector",
      "prompt_ir_agent_id": "sector.semiconductor",
      "required_tools": [
        "get_sector_research_snapshot",
        "get_role_event_snapshot",
        "get_balance_sheet",
        "get_broker_research",
        "get_cashflow",
        "get_etf_holdings",
        "get_income_statement",
        "get_indicators",
        "get_industry_moneyflow",
        "get_industry_policy_digest",
        "get_rke_research_context",
        "get_sector_index_membership",
        "get_stock_data",
        "get_supply_chain_evidence"
      ],
      "output_schema_fields": [
        "agent",
        "selection_status",
        "preferred_direction",
        "least_preferred_direction",
        "persistence_horizon",
        "confidence",
        "key_drivers",
        "risks",
        "claims",
        "claim_refs",
        "preferred_security_status",
        "preferred_security_abstention_confidence",
        "long_picks",
        "least_preferred_security_status",
        "least_preferred_security_abstention_confidence",
        "short_or_avoid_picks",
        "macro_input_attributions"
      ],
      "stages": [
        {
          "stage": "agent_run",
          "enablement": "enabled",
          "output_schema_ref": "sector.semiconductor.output.v1",
          "output_schema_fields": [
            "agent",
            "selection_status",
            "preferred_direction",
            "least_preferred_direction",
            "persistence_horizon",
            "confidence",
            "key_drivers",
            "risks",
            "claims",
            "claim_refs",
            "preferred_security_status",
            "preferred_security_abstention_confidence",
            "long_picks",
            "least_preferred_security_status",
            "least_preferred_security_abstention_confidence",
            "short_or_avoid_picks",
            "macro_input_attributions"
          ],
          "max_repair_attempts": 3,
          "required_source_ids": [],
          "produced_source_ids": [
            "upstream_agent_outputs"
          ]
        }
      ]
    },
    {
      "agent": "technology",
      "layer": "sector",
      "prompt_ir_agent_id": "sector.technology",
      "required_tools": [
        "get_sector_research_snapshot",
        "get_role_event_snapshot",
        "get_broker_research",
        "get_etf_holdings",
        "get_indicators",
        "get_industry_moneyflow",
        "get_industry_policy_digest",
        "get_rke_research_context",
        "get_sector_index_membership",
        "get_stock_data",
        "get_supply_chain_evidence"
      ],
      "output_schema_fields": [
        "agent",
        "selection_status",
        "preferred_direction",
        "least_preferred_direction",
        "persistence_horizon",
        "confidence",
        "key_drivers",
        "risks",
        "claims",
        "claim_refs",
        "preferred_security_status",
        "preferred_security_abstention_confidence",
        "long_picks",
        "least_preferred_security_status",
        "least_preferred_security_abstention_confidence",
        "short_or_avoid_picks",
        "macro_input_attributions"
      ],
      "stages": [
        {
          "stage": "agent_run",
          "enablement": "enabled",